//////////////////////////////////////////////////////////////
Assig 2

mysql> create table user(userid int primary key auto_increment,name varchar(30)password varchar(30))$$
ERROR 1064 (42000): You have an error in your SQL syntax; check the manual that corresponds to your MySQL server version for the right syntax to use near 'password varchar(30))' at line 1
mysql> create table user(userid int primary key auto_increment,name varchar(30),password varchar(30))$$
Query OK, 0 rows affected (0.07 sec)

mysql> create table user(userid int,name varchar(30),old_password varchar(30),Time time)$$
ERROR 1050 (42S01): Table 'user' already exists
mysql> create table user_history(userid int,name varchar(30),old_password varchar(30),Time time)$$
Query OK, 0 rows affected (0.04 sec)

mysql> insert into user(name,password) valuse('Abhi','abhi123')$$
ERROR 1064 (42000): You have an error in your SQL syntax; check the manual that corresponds to your MySQL server version for the right syntax to use near 'valuse('Abhi','abhi123')' at line 1
mysql> insert into user(name,password) values('Abhi','abhi123')$$
Query OK, 1 row affected (0.01 sec)

mysql> insert into user(name,password) values('Arun','arun123')$$
Query OK, 1 row affected (0.01 sec)

mysql> insert into user(name,password) values('Ajit','ajit123')$$
Query OK, 1 row affected (0.01 sec)

mysql> select*from user$$
+--------+------+----------+
| userid | name | password |
+--------+------+----------+
|      1 | Abhi | abhi123  |
|      2 | Arun | arun123  |
|      3 | Ajit | ajit123  |
+--------+------+----------+
3 rows in set (0.00 sec)

mysql> create trigger update_user_history
    -> before update on user for each row
    -> begin
    -> insert into user_history(Name,old_password,Time) values(old.Name, old.Password, current_time());
    -> end
    -> $$
Query OK, 0 rows affected (0.03 sec)

mysql> update user set password='arun456' where userid=2$$
Query OK, 1 row affected (0.03 sec)
Rows matched: 1  Changed: 1  Warnings: 0

mysql> select*from user_history$$
+--------+------+--------------+----------+
| userid | name | old_password | Time     |
+--------+------+--------------+----------+
|   NULL | Arun | arun123      | 12:34:41 |
+--------+------+--------------+----------+
1 row in set (0.00 sec)

mysql> select*from user$$
+--------+------+----------+
| userid | name | password |
+--------+------+----------+
|      1 | Abhi | abhi123  |
|      2 | Arun | arun456  |
|      3 | Ajit | ajit123  |
+--------+------+----------+
3 rows in set (0.00 sec)

mysql> update user set password='abhi456' where userid=1$$
Query OK, 1 row affected (0.02 sec)
Rows matched: 1  Changed: 1  Warnings: 0

mysql> update user set password='ajit456' where userid=3$$
Query OK, 1 row affected (0.02 sec)
Rows matched: 1  Changed: 1  Warnings: 0

mysql> select*from user$$
+--------+------+----------+
| userid | name | password |
+--------+------+----------+
|      1 | Abhi | abhi456  |
|      2 | Arun | arun456  |
|      3 | Ajit | ajit456  |
+--------+------+----------+
3 rows in set (0.00 sec)

mysql> select*from user_history$$
+--------+------+--------------+----------+
| userid | name | old_password | Time     |
+--------+------+--------------+----------+
|   NULL | Arun | arun123      | 12:34:41 |
|   NULL | Abhi | abhi123      | 12:35:44 |
|   NULL | Ajit | ajit123      | 12:35:54 |
+--------+------+--------------+----------+
3 rows in set (0.00 sec)

mysql>


///////////////////////////////////////////////////////////////
mysql> drop table person;
Query OK, 0 rows affected (0.09 sec)

mysql> select*from person;
ERROR 1146 (42S02): Table 'employe_table.person' doesn't exist
mysql> create table person (id int primary key, name varchar(15), gender varchar(40));
Query OK, 0 rows affected (0.04 sec)

mysql> insert into person values(10, 'Abhi', 'Male');
Query OK, 1 row affected (0.02 sec)

mysql> insert into person values(11, 'Akansha', 'Female');
Query OK, 1 row affected (0.01 sec)

mysql> insert into person values(12, 'Arun', 'Male');
Query OK, 1 row affected (0.01 sec)

mysql> select*from person;
+----+---------+--------+
| id | name    | gender |
+----+---------+--------+
| 10 | Abhi    | Male   |
| 11 | Akansha | Female |
| 12 | Arun    | Male   |
+----+---------+--------+
3 rows in set (0.00 sec)

mysql> delimiter #
mysql> create procedure p1(IN i int)
    -> begin
    -> declare n varchar(40);
    -> declare g varchar(40);
    -> select name,gender into n,g from person where id=i;
    -> if g='Male' then
    -> select concat('Mr',n);
    -> else
    -> select concat('Ms',n);
    -> end if;
    -> end
    -> #
Query OK, 0 rows affected (0.01 sec)

mysql> call p1(10)#
+----------------+
| concat('Mr',n) |
+----------------+
| MrAbhi         |
+----------------+
1 row in set (0.01 sec)

Query OK, 0 rows affected (0.02 sec)

mysql> call p1(11)#
+----------------+
| concat('Ms',n) |
+----------------+
| MsAkansha      |
+----------------+
1 row in set (0.00 sec)

Query OK, 0 rows affected (0.01 sec)

mysql> call p1(12)#
+----------------+
| concat('Mr',n) |
+----------------+
| MrArun         |
+----------------+
1 row in set (0.00 sec)

Query OK, 0 rows affected (0.01 sec)

mysql>